{"artifact_set_id":"set_5a3ca50a2bbb43e3b0dcf0964f0e4b0d","artifacts":[{"artifact_id":"82a7039a-09b4-4674-8ed4-d55c65476f32","definition_id":null,"kind":"step","mime_type":"model/step","relative_path":"assembly.step","revision_id":"rev_1fee1f81a0cc4c3c8dbdd51f68beec4b","sha256":"f165ca51300eb74349b8cd160a005c640821310ce0bc36fd0000b94dced4caf5","size_bytes":50829,"spec_sha256":"2d4c00c1478a2cc839f2c3a32bbd6d2072196de2e0f8cb736ab08d9d3560aa2b"},{"artifact_id":"7c6cffd6-1de8-4d76-86ac-764487849d0d","definition_id":"panel_side","kind":"step","mime_type":"model/step","relative_path":"parts/panel_side.step","revision_id":"rev_1fee1f81a0cc4c3c8dbdd51f68beec4b","sha256":"415b7bf0bb893a0c898acab4e132b0169e65466d685ba01900d7959cad5e5e46","size_bytes":17058,"spec_sha256":"2d4c00c1478a2cc839f2c3a32bbd6d2072196de2e0f8cb736ab08d9d3560aa2b"},{"artifact_id":"27653ddf-a921-48c6-9e3e-a8c5e175128c","definition_id":"panel_side","kind":"glb","mime_type":"model/gltf-binary","relative_path":"parts/panel_side.glb","revision_id":"rev_1fee1f81a0cc4c3c8dbdd51f68beec4b","sha256":"bc616342ff6fa7afa81024d336d278167fa3e14ae791873faf1203dd0d0d55b2","size_bytes":1852,"spec_sha256":"2d4c00c1478a2cc839f2c3a32bbd6d2072196de2e0f8cb736ab08d9d3560aa2b"},{"artifact_id":"5d17ad5e-893e-4dec-858e-89bb0df010c8","definition_id":"panel_horizontal","kind":"step","mime_type":"model/step","relative_path":"parts/panel_horizontal.step","revision_id":"rev_1fee1f81a0cc4c3c8dbdd51f68beec4b","sha256":"ef47c5c8677c1938bb485ce44dfb40a59337f69e5c236d8fdfe56a8af2f8d36b","size_bytes":17028,"spec_sha256":"2d4c00c1478a2cc839f2c3a32bbd6d2072196de2e0f8cb736ab08d9d3560aa2b"},{"artifact_id":"952814b4-40e5-4eb9-92e1-b2ee3a5a5581","definition_id":"panel_horizontal","kind":"glb","mime_type":"model/gltf-binary","relative_path":"parts/panel_horizontal.glb","revision_id":"rev_1fee1f81a0cc4c3c8dbdd51f68beec4b","sha256":"d2a4076311f4721b9dfaf66ac00c0d92eba9adb8f8caad4931f3497806029a35","size_bytes":1852,"spec_sha256":"2d4c00c1478a2cc839f2c3a32bbd6d2072196de2e0f8cb736ab08d9d3560aa2b"},{"artifact_id":"ac956e02-ae2e-425e-8300-63f747c0785a","definition_id":"panel_back","kind":"step","mime_type":"model/step","relative_path":"parts/panel_back.step","revision_id":"rev_1fee1f81a0cc4c3c8dbdd51f68beec4b","sha256":"8630f3b0aa13eff3df78c4e0625b4169fc15dcbb2dbbf1ad92de7c02b8b66319","size_bytes":17024,"spec_sha256":"2d4c00c1478a2cc839f2c3a32bbd6d2072196de2e0f8cb736ab08d9d3560aa2b"},{"artifact_id":"4a3ebfbf-34e7-401f-9517-986f9938243b","definition_id":"panel_back","kind":"glb","mime_type":"model/gltf-binary","relative_path":"parts/panel_back.glb","revision_id":"rev_1fee1f81a0cc4c3c8dbdd51f68beec4b","sha256":"0dc1b573c02d35771d86a2ef66f563eab7c1aa4e189ad8cd186be02afa322e22","size_bytes":1856,"spec_sha256":"2d4c00c1478a2cc839f2c3a32bbd6d2072196de2e0f8cb736ab08d9d3560aa2b"},{"artifact_id":"31f2bece-1940-496e-a9dd-a4a926b2bc9c","definition_id":null,"kind":"json","mime_type":"application/json","relative_path":"project.json","revision_id":"rev_1fee1f81a0cc4c3c8dbdd51f68beec4b","sha256":"2d4c00c1478a2cc839f2c3a32bbd6d2072196de2e0f8cb736ab08d9d3560aa2b","size_bytes":1328,"spec_sha256":"2d4c00c1478a2cc839f2c3a32bbd6d2072196de2e0f8cb736ab08d9d3560aa2b"},{"artifact_id":"ae4d7156-2471-4911-8d74-3d59fd1af327","definition_id":null,"kind":"json","mime_type":"application/json","relative_path":"resolved-project.json","revision_id":"rev_1fee1f81a0cc4c3c8dbdd51f68beec4b","sha256":"56043007537e6f382b6c3d80652f595600b964299cb43c86f99e9385e7cc05d6","size_bytes":12839,"spec_sha256":"2d4c00c1478a2cc839f2c3a32bbd6d2072196de2e0f8cb736ab08d9d3560aa2b"},{"artifact_id":"b2841ab7-ade2-48a8-a9d4-67882fc9993d","definition_id":null,"kind":"json","mime_type":"application/json","relative_path":"materials.json","revision_id":"rev_1fee1f81a0cc4c3c8dbdd51f68beec4b","sha256":"65e5b3aac849d53931df7dbd3b19369faef57557560d1334e938583e8fee8030","size_bytes":562,"spec_sha256":"2d4c00c1478a2cc839f2c3a32bbd6d2072196de2e0f8cb736ab08d9d3560aa2b"},{"artifact_id":"7f099a47-083e-4aec-b0db-0a6d2f920c86","definition_id":null,"kind":"json","mime_type":"application/json","relative_path":"geometry-validation.json","revision_id":"rev_1fee1f81a0cc4c3c8dbdd51f68beec4b","sha256":"df35b2348dd8e5245cdcb389c7ed80052ac644527af8e8302d370f14862a1a06","size_bytes":9090,"spec_sha256":"2d4c00c1478a2cc839f2c3a32bbd6d2072196de2e0f8cb736ab08d9d3560aa2b"},{"artifact_id":"1f1ccfa1-ffcb-437f-9554-4a905bb17ce2","definition_id":null,"kind":"json","mime_type":"application/json","relative_path":"build-inputs.json","revision_id":"rev_1fee1f81a0cc4c3c8dbdd51f68beec4b","sha256":"5fa10bbe571e8249ff4bbb39b33e868d3f9849ddda01ff9ec2e56abdcc9ef0fb","size_bytes":1413,"spec_sha256":"2d4c00c1478a2cc839f2c3a32bbd6d2072196de2e0f8cb736ab08d9d3560aa2b"},{"artifact_id":"7aa9e3cd-f0e6-4211-88e1-1dfee8dbb95b","definition_id":null,"kind":"json","mime_type":"application/json","relative_path":"step-instance-map.json","revision_id":"rev_1fee1f81a0cc4c3c8dbdd51f68beec4b","sha256":"ca1811ee5e2be8e0e4354fc0b1cc502d02527e14aeb8655302530a123f7bc4f5","size_bytes":922,"spec_sha256":"2d4c00c1478a2cc839f2c3a32bbd6d2072196de2e0f8cb736ab08d9d3560aa2b"},{"artifact_id":"86f9ae8f-0204-44cc-9dfd-8f2a3f5bc372","definition_id":null,"kind":"csv","mime_type":"text/csv; charset=utf-8","relative_path":"cut-list.csv","revision_id":"rev_1fee1f81a0cc4c3c8dbdd51f68beec4b","sha256":"bad8fc79e4c4cc4507de46df3447db5cda0b425a5c2274cf4955943e133613dd","size_bytes":1166,"spec_sha256":"2d4c00c1478a2cc839f2c3a32bbd6d2072196de2e0f8cb736ab08d9d3560aa2b"},{"artifact_id":"a063bb79-01ce-4a67-a752-eb77565f4262","definition_id":null,"kind":"text","mime_type":"text/plain; charset=utf-8","relative_path":"readme.txt","revision_id":"rev_1fee1f81a0cc4c3c8dbdd51f68beec4b","sha256":"69cfe7b2a2a590a6194172f31621f30939203ce0c4ebe6e499a7238c2a02a84b","size_bytes":626,"spec_sha256":"2d4c00c1478a2cc839f2c3a32bbd6d2072196de2e0f8cb736ab08d9d3560aa2b"}],"build_key_sha256":"5fa10bbe571e8249ff4bbb39b33e868d3f9849ddda01ff9ec2e56abdcc9ef0fb","capabilities":["geometry"],"construction":{"findings":[],"physical_review":"not_reviewed","recipe_id":null,"recipe_version":null,"status":"recipe_unselected"},"coordinates":{"cad_axes":"x_width_y_depth_z_height","cad_to_preview":"x_z_neg_y_times_0.001","cad_units":"mm","part_axes":"x_length_y_width_z_thickness","part_origin":"center","preview_units":"m"},"manifest_schema_version":"1.0.0","part_definitions":[{"definition_id":"panel_side","finished_mm":{"length_mm":"914.4","thickness_mm":"18","width_mm":"298.8"},"grain_axis":"L","manufacturing_sha256":"8ea788299ecb20009524e9875af6e09d1359f49836ef2890b9500e71369c9bff","material_id":"plywood_main","member_instance_ids":["side_left","side_right"],"quantity":2,"rough_mm":{"length_mm":"914.4","thickness_mm":"18","width_mm":"298.8"}},{"definition_id":"panel_horizontal","finished_mm":{"length_mm":"726","thickness_mm":"18","width_mm":"298.8"},"grain_axis":"L","manufacturing_sha256":"26a21aaef9785251748598925dc8a14a9c43a045a6f4373f0985d1a8b93e299d","material_id":"plywood_main","member_instance_ids":["bottom","shelf_01","shelf_02","top"],"quantity":4,"rough_mm":{"length_mm":"726","thickness_mm":"18","width_mm":"298.8"}},{"definition_id":"panel_back","finished_mm":{"length_mm":"914.4","thickness_mm":"6","width_mm":"762"},"grain_axis":"L","manufacturing_sha256":"9136f8add2d3fb38557733a9b77609aca022d0985253f60d140ef7780f81ee8a","material_id":"plywood_back","member_instance_ids":["back"],"quantity":1,"rough_mm":{"length_mm":"914.4","thickness_mm":"6","width_mm":"762"}}],"part_instances":[{"center_mm":{"x":"9","y":"149.4","z":"457.2"},"definition_id":"panel_side","instance_id":"side_left","rotation_cad_rows":[[0,0,-1],[0,1,0],[1,0,0]]},{"center_mm":{"x":"753","y":"149.4","z":"457.2"},"definition_id":"panel_side","instance_id":"side_right","rotation_cad_rows":[[0,0,-1],[0,1,0],[1,0,0]]},{"center_mm":{"x":"381","y":"149.4","z":"9"},"definition_id":"panel_horizontal","instance_id":"bottom","rotation_cad_rows":[[1,0,0],[0,1,0],[0,0,1]]},{"center_mm":{"x":"381","y":"149.4","z":"307.8"},"definition_id":"panel_horizontal","instance_id":"shelf_01","rotation_cad_rows":[[1,0,0],[0,1,0],[0,0,1]]},{"center_mm":{"x":"381","y":"149.4","z":"606.6"},"definition_id":"panel_horizontal","instance_id":"shelf_02","rotation_cad_rows":[[1,0,0],[0,1,0],[0,0,1]]},{"center_mm":{"x":"381","y":"149.4","z":"905.4"},"definition_id":"panel_horizontal","instance_id":"top","rotation_cad_rows":[[1,0,0],[0,1,0],[0,0,1]]},{"center_mm":{"x":"381","y":"301.8","z":"457.2"},"definition_id":"panel_back","instance_id":"back","rotation_cad_rows":[[0,1,0],[0,0,1],[1,0,0]]}],"project_id":"runtime_preflight","resolved_sha256":"d81132362ea0a2b73cea1d3cffe4a6d18a5af0352a8ae83f1141f1c71643f8dc","revision_id":"rev_1fee1f81a0cc4c3c8dbdd51f68beec4b","revision_number":1,"source_artifact_set_id":null,"spec_sha256":"2d4c00c1478a2cc839f2c3a32bbd6d2072196de2e0f8cb736ab08d9d3560aa2b","validation":{"documents":"not_requested","geometry":"passed","parameters":"passed","stock_layout":"not_requested"},"versions":{"adapter":"1.0.0","app":"0.1.0","build123d":"0.11.1","cadgen":"0.7.21","compiler":"1.0.0","dependency_lock_sha256":"f92cdecc61c68516333b8f210b9e6db3fd279659cfb0fcfc2b135dd3c06b2618","node":"24.13.0","ocp":"7.9.3.1.1","python":"3.13.9","recipe_fingerprint":null,"template":"1.0.0"}}